Job Title,Salary Estimate,Job Description,Rating,Company Name,Location,Headquarters,Size,Founded,Type of ownership,Industry,Sector,Revenue,Competitors
Data Scientist,$165K-$257K (Glassdoor est.),"Who we are: Fueled by a fundamental belief that having access to financial services creates opportunity, PayPal (NASDAQ: PYPL) is committed to democratizing financial services and empowering people and businesses to join and thrive in the global economy. Our open digital payments platform gives PayPal’s 286 million active account holders the confidence to connect and transact in new and powerful ways, whether they are online, on a mobile device, in an app, or in person. Through a combination of technological innovation and strategic partnerships, PayPal creates better ways to manage and move money, and offers choice and flexibility when sending payments, paying or getting paid. Available in more than 200 markets around the world, the PayPal platform, including Braintree, Venmo and Xoom enables consumers and merchants to receive money in more than 100 currencies, withdraw funds in 56 currencies and hold balances in their PayPal accounts in 25 currencies.
Job Description Summary: · Develop and validate advanced predictive models using advanced data mining and machine learning techniques. · Collaborate with other data scientists and engineers to formulate innovative solutions to experiment and implement advanced data mining techniques · Work with large volumes of data; extract and manipulate large datasets using standard tools such as Python, Hadoop, R, SQL · Analyze data covering a wide range of information from user profile to transaction history. Identify new risk patterns through data mining · Communicate complex concepts and the results of the analyses in a clear and effective manner through creative visualization · Coach and mentor junior data scientists
Job Description:
MS in a science or engineering field with 4+ years of relevant professional experience. Ph.D. degree preferred
Have a passion for working on big data and professional experience in data mining, statistical analysis, predictive modeling and data manipulation.
Strong Unix background and programming experience in C/C++, or Java, and skills in scripting languages such as Perl or Python. Familiar with various Machine Learning algorithms and Statistical methods
Strong problem solving skills and communication skills
SQL and Hadoop / Other Big Data skills preferred
A strong plus for candidate with credit risk or financial services experiences
We're a purpose-driven company whose beliefs are the foundation for how we conduct business every day. We hold ourselves to our One Team Behaviors which demand that we hold the highest ethical standards, to empower an open and diverse workplace, and strive to treat everyone who is touched by our business with dignity and respect. Our employees challenge the status quo, ask questions, and find solutions. We want to break down barriers to financial empowerment. Join us as we change the way the world defines financial freedom.
PayPal provides equal employment opportunity (EEO) to all persons regardless of age, color, national origin, citizenship status, physical or mental disability, race, religion, creed, gender, sex, pregnancy, sexual orientation, gender identity and/or expression, genetic information, marital status, status with regard to public assistance, veteran status, or any other characteristic protected by federal, state or local law. In addition, PayPal will provide reasonable accommodations for qualified individuals with disabilities.",4.0,"PayPal
4.0","San Jose, CA",-1,10000+ Employees,1998,Company - Public,Internet,Information Technology,$10+ billion (USD),-1
"Data Scientist, Site Services",$165K-$257K (Glassdoor est.),"The Position

The Site Services Data Scientist will report to the Director of Digital Innovation & Analytics. This role presents a unique opportunity to apply data science to help Genentech build the workplace of the future. The Data Scientist will support all Site Services business functions: Site Operations, Environment, Health & Safety (EHS), Workforce Services, Workplace Effectiveness, Security & Resilience and Strategy & Business Operations with insights gained from analyzing company data. Inform the design and operations of the Physical Work Environment, Employee Services and Technology (e.g. advanced sensor technologies / IoT) so Genentech employees can be at their best when serving patients.

The ideal candidate has experience applying data science to impact business outcomes, and enjoys pushing the boundaries to innovate. You will conduct analyses and develop models utilizing a variety of statistical, machine learning, pattern recognition, and artificial intelligence algorithms to support Site Services to make evidence based business decisions that ensure employee productivity and well-being as well as operational efficiency.
You will partner with data engineers in IT on designing and implementing our data and data pipeline architecture, optimizing data flow and collection across Site Services, as well as evolving our IoT strategy.

Responsibilities

Leverage data to discover patterns and solve strategic analytic business problems

Execute sophisticated analyses and advanced modeling that result in actionable recommendations

Collaborate with subject matter experts across Site Services and the business

Lead and contribute to data integrity and data forensics efforts

Provide coaching and training on use and interpretation of data / metrics

Define requirements and work with local and global Informatics (IT) to design, build and maintain the Site Services Analytics platform

Design and implement self-service reporting tools (e.g. Tableau)

Build AI / machine learning solutions that capitalize on data to drive employee productivity / well-being and operational efficiency

Support selection or development of apps that turn data into tools for employees

Design and implement data driven automation efforts

Requirements:
BA/BS degree in Computer Science, Data Science, Analytics, Engineering, Psychology, Statistics, or technical field or equivalent experience

Business Experience 2+ years of experience in data related fields - experience with research programs that seek practical/predictive (rather than only statistical) significance is particularly valued

Experience working with large, complex data systems to aggregate, organize, and prepare data for use in business analysis

Extensive background in data mining, statistical analysis, machine learning, and predictive modeling to drive insights from data

Demonstrated experience in bridging business requirements and technical development

Good communication skills - ability to communicate on technical content and data with non-technical business stakeholders

Specialized Knowledge / Skills

Data-oriented scripting (e.g. SQL) and statistical programming (e.g., Python / R)

Classical statistics and machine learning approaches to fitting models (e.g., ensembles, bootstrapping) and estimating their performance (e.g., cross-validation)

Developing shared code (e.g., version control, programming patterns, libraries/packages) and creating data pipelines

Experience working with AWS (S3, EC2, Redshift, Sagemaker, Forecast, etc.) , and big data toolkits

Experience with computer vision and natural language processing

Experience working with Tableau, Qlikview a plus

Experience with table design joins, data aggregation, data validation

Desirable (not required)

Experience working with Facilities data / smart building technologies

Experience working with HR / organizational people data

Experimental design and analysis, including validating questionnaires, designing surveys

Architecture background/experience working with architects, space planners and interior design specialists

Publicly available examples of code (github, etc) or projects (websites, decks, publications)

This position is not eligible for relocation
Who We Are
Genentech, a member of the Roche group and founder of the biotechnology industry, is dedicated to pursuing groundbreaking science to discover and develop medicines for people with serious and life-threatening diseases. To solve the world's most complex health challenges, we ask bigger questions that challenge our industry and the boundaries of science to transform society. Our transformational discoveries include the first targeted antibody for cancer and the first medicine for primary progressive multiple sclerosis.
Diversity and Inclusion (D&I) are critical to the success of our company and our impact on society. We believe that by championing diversity of background, thought and experience, we can foster a sense of belonging and provide an environment where every employee feels valued, included, and able to contribute their best for the patients we serve. We’re focused on attracting, retaining, developing and advancing our people to their full potential by rewarding bold ways of thinking and integrating inclusive behaviors into every aspect of our work.
The next step is yours. To apply today, click on the ""Apply for this job"" button.
Genentech is an equal opportunity employer & prohibits unlawful discrimination based on race, color, religion, gender, sexual orientation, gender identity/expression, national origin/ancestry, age, disability, marital & veteran status. For more information about equal employment opportunity, visit our Genentech Careers page . Job Facts JOB FUNCTION
Digitalisation / Data / Insights COMPANY/DIVISION
Pharmaceuticals SCHEDULE
Full time JOB TYPE
Regular",4.2,"GENENTECH
4.2","San Francisco, CA",-1,10000+ Employees,1976,Subsidiary or Business Segment,Biotech & Pharmaceuticals,Biotech & Pharmaceuticals,$10+ billion (USD),-1
(Lead Data Scientist) \ Lead Product Analyst,$165K-$257K (Glassdoor est.),"(Lead Data Scientist) \ Lead Product Analyst

Fivestars is America's largest local commerce network, driving over $3 billion of sales and 100 million transactions annually. Our mission is to help businesses and communities thrive by turning every transaction into a relationship. We offer an all-in-one payments, loyalty and marketing automation platform that brings more customers to local businesses. Founded in 2011, Fivestars is backed by Lightspeed, DCM, Menlo Ventures, HarbourVest, and others. Together, let's #LoveLocal. For more information visit: www.fivestars.com.

Who you are

As a Lead Product Analyst, you will serve as an analytics and machine learning expert and use data and experiments to develop insights that will directly influence the product roadmap. You are a strong cross-functional team player who wants to contribute to a product that impacts the lives of business owners and consumers alike. You are flexible and enjoy working collaboratively in fast-paced environments.

What you'll do
Develop models and algorithms that deepen our understanding of user behavior & identify business opportunities for Fivestars
Lead the design and development of A/B testing experiments from determining how they should be run and evaluating their impact on key company metrics
Partner with product, engineering, and research and use your data insights to influence product roadmap development
Mentor data scientists and analysts in the team and help them develop their technical knowledge, skills, judgment and ensure consistent delivery of high caliber output
Collaborate with other members of the analytics team to design, build, maintain, and standardize analytics processes and systems
What we're looking for
Quantitative Bachelor's degree in Statistics, Economics, Mathematics, Operations Research or Engineering
7-8 years relevant experience in analytics, B2B or fintech experience preferred
4+ years of hands-on expertise with data mining and statistical modeling techniques such as experimentation, clustering, classification, regression, tree-based methods, neural nets, support vector machines, anomaly detection, and natural language processing
Deep understanding of statistical methods and comfort with complex models
Experience with a scripting language like Python or R
Strong experience building out dashboards in Tableau to help run the business
Experience building metric frameworks to understand user behaviors
Strong ability to use experimentation (A/B testing) and statistical/predictive analysis to guide decision making
Strong track record of working with cross-functional teams to accomplish objectives and achieve highly impactful results
Understanding of wider context and the business case behind questions and uses creative methods to drive results
Fivestars provides equal employment opportunities (EEO) to all employees and applicants for employment without regard to race, color, religion, sex, national origin, age, disability or genetics. In addition to federal law requirements, Fivestars complies with applicable state and local laws governing nondiscrimination in employment in every location in which the company has facilities. This policy applies to all terms and conditions of employment, including recruiting, hiring, placement, promotion, termination, layoff, recall, transfer, leaves of absence, compensation, and training.",4.0,"Fivestars
4.0","San Francisco, CA",-1,201 to 500 Employees,2011,Company - Private,Internet,Information Technology,$100 to $500 million (USD),-1
"Data Scientist (Machine Learning and Automation, Financial Solutions Group)",$165K-$257K (Glassdoor est.),"The Position

As a Data Scientist in Machine Learning and Automation in the Financial Solutions Group (FSG), you will be accountable for creating machine learning algorithms and designing solutions to automate financial processes. You are expected to lead and act as a valuable contributor in multidisciplinary project teams by providing deep technical expertise across data exploration, visualization, NLP, model validation, scale-up, and model refresh. You will make decisions on how to integrate machine learning into business practice, and embedding predictive models into automated processes that run at scale. You will be a respected member of a vibrant data science community of thousands, and in project teams at stages ranging from planning to at-scale operations.

Key responsibilities of this role include the following:
Cultivate and foster trusting relationships with business partners in all Genentech Finance functions including CMG Finance, Site Ops Finance, Controller's Group and gRED Finance, by meeting often, analyzing needs, understanding perspectives, influencing and advising on the application of machine learning and automation to improve processes

Partner with FSG business analysts to analyze end-to-end business processes and work in cross-functional project teams to develop requirements, automate full processes, develop NLP and OCR algorithms for key steps, and embed and monitor the solutions to streamline operations

Interact with Analytics, Data Science and Artificial Intelligence teams across Genentech and Roche to bring best in class solutions to impact decisions.

Help optimize investment in areas like sales and marketing by developing and applying tools, visualizations, and ML models

Automate business processes and analyses, in areas like applying OCR and NLP to categorize contracts and automatically process purchase orders

Make decisions to select technologies and tools, and on implementation plans

Technical responsibilities will include data cleansing, quality assurance metrics, data exploration, feature engineering and visualization

Machine learning responsibilities will include utilizing NLP and OCR techniques and developing, scaling and refreshing predictive models

You will also develop test and training sets, apply supervised and unsupervised methods, and apply algorithms such as clustering techniques, Random Forests, Gradient Boosting, etc.

You will characterize the accuracy of models across use cases, create benchmarks, develop unit tests, bring models to production deployment, monitor the usage and accuracy of models in production, and refresh models as needed

Collaborate with other key players in ML and automation at the Roche global level, including Roche Global RSS (Shared Services), ERP Analytics and centers of excellence (CoFI and CoRE), to ensure requirements for new solutions and enhancements are managed and delivered effectively, and ensure solutions meet the customer's needs

We are looking for candidates with the following skills:
A strong learning mind-set and not afraid to take risks

An entrepreneurial mindset and self-direction, ability to lead and teach others and willingness to learn new techniques

Excellent communication skills and ability to communicate with non-technical partners

Strong team-player and ability to understand the perspectives of team members from other disciplines or backgrounds

Qualifications of candidates:
A Master’s Degree or PHD in a technical area such as Computer Science, Engineering Disciplines, Statistics or similar fields is preferred

Minimum 3 - 5 years of experience in manipulating data sets and building statistical models, with experience in NLP and/or automation is preferred

Experience with AWS and other platforms like Google Cloud

Experience with Python and R, and libraries like Pandas and SKLearn

Experience with tools like SageMaker, Anaconda, and Jupyter Notebooks

Experience with Finance and/or business operations is desirable

Biotechnology, Pharma or Health experience is a plus

Who We Are
A member of the Roche Group, Genentech has been at the forefront of the biotechnology industry for more than 40 years, using human genetic information to develop novel medicines for serious and life-threatening diseases. Genentech has multiple therapies on the market for cancer & other serious illnesses. Please take this opportunity to learn about Genentech where we believe that our employees are our most important asset & are dedicated to remaining a great place to work.
Genentech is an equal opportunity employer & prohibits unlawful discrimination based on race, color, religion, gender, sexual orientation, gender identity/expression, national origin/ancestry, age, disability, marital & veteran status. For more information about equal employment opportunity, visit our Genentech Careers page.
Who We Are
Genentech, a member of the Roche group and founder of the biotechnology industry, is dedicated to pursuing groundbreaking science to discover and develop medicines for people with serious and life-threatening diseases. To solve the world's most complex health challenges, we ask bigger questions that challenge our industry and the boundaries of science to transform society. Our transformational discoveries include the first targeted antibody for cancer and the first medicine for primary progressive multiple sclerosis.
Diversity and Inclusion (D&I) are critical to the success of our company and our impact on society. We believe that by championing diversity of background, thought and experience, we can foster a sense of belonging and provide an environment where every employee feels valued, included, and able to contribute their best for the patients we serve. We’re focused on attracting, retaining, developing and advancing our people to their full potential by rewarding bold ways of thinking and integrating inclusive behaviors into every aspect of our work.
The next step is yours. To apply today, click on the ""Apply for this job"" button.
Genentech is an equal opportunity employer & prohibits unlawful discrimination based on race, color, religion, gender, sexual orientation, gender identity/expression, national origin/ancestry, age, disability, marital & veteran status. For more information about equal employment opportunity, visit our Genentech Careers page . Job Facts JOB FUNCTION
Digitalisation / Data / Insights COMPANY/DIVISION
Pharmaceuticals SCHEDULE
Full time JOB TYPE
Regular",4.2,"GENENTECH
4.2","San Francisco, CA",-1,10000+ Employees,1976,Subsidiary or Business Segment,Biotech & Pharmaceuticals,Biotech & Pharmaceuticals,$10+ billion (USD),-1
Data Scientist,$165K-$257K (Glassdoor est.),"The Chan Zuckerberg Biohub (""CZ Biohub”) is an independent nonprofit medical research organization based in the San Francisco Bay Area. The Chan Zuckerberg Biohub supports scientific research to cure, prevent or manage disease in our children’s lifetime. Our mission is to understand the fundamental mechanisms underlying disease and to develop new technologies which will lead to actionable diagnostics and effective therapies. We harness the power and possibility of collaboration to drive discovery and set the standard for open, impactful science. For more information, please visit czbiohub.org.

Opportunity

The Data Science and Infectious Disease teams at CZ Biohub work closely with local, national, and international organizations and departments of public health to enable informed decision making using next-generation sequencing data, advanced statistical analyses and mathematical modeling. During the coronavirus pandemic, CZ Biohub has been working with UCSF to provide COVID-19 testing, sequencing samples and providing actionable information to local health departments, and enabling genomics-based surveillance in California through phylogenetics and mathematical modeling.

We are looking for a data scientist with mathematical modeling experience to join our team for predictive and analytical projects related to the COVID-19 pandemic. The role will involve working directly with public health departments to understand their needs and to provide actionable information from modeling analyses to support public health decision and policy making. In addition to working on specific public health problems, the data scientist will contribute to open-source software and workflows, develop new methods as needed, and collaborate with academic researchers on scientific projects. Strong communication skills are essential for this position in addition to technical skills.

We are open to more junior candidates who have at least a Bachelor’s degree, and relevant coursework and internship experience.

Requirements
PhD in Epidemiology, Population Genetics, Ecology and Evolution, Systems Biology, Computational Biology, Machine Learning or related disciplines;
OR Bachelor’s/Master’s in the above disciplines with relevant experience;
Working knowledge of Bayesian statistics and inference;
Experience with or relevant coursework in mathematical models used to study infectious disease transmission, ecology, mobility, networks or related areas;
2+ years of experience with Python or R;
Experience with data visualization software or packages such as ggplot2, matplotlib, d3;
Strong communication skills with both technical and non-specialist audiences.
In the cover letter, candidates should address:
Why are you interested in working on infectious disease modeling projects?
Why are you interested in working for CZ Biohub?
How does this role fit into your longer-term goals?
Preferred/Desired Qualifications
Previous experience with whole genome sequencing, mobility, or geospatial data;
Experience working with decision-makers in government and healthcare institutions;
Understanding of infectious disease and epidemiologic processes;
Experience with cloud computing, Github, or machine learning.
What We Provide
Resources to disrupt and innovate at the frontiers of our knowledge of biology and disease.
A collegial and collaborative environment consisting of diverse expertise.
Existing collaborations within CZ Biohub: Advanced Optical Microscopy, Cell Atlas, Bioengineering, Data Science, Genome Editing, and Infectious Diseases.
Access to collaborators, resources and facilities at the three partner campuses (UCSF, Berkeley and Stanford) and at partner institutions in the Bay Area and beyond.
Competitive compensation and benefits commensurate with the experience.
Benefits

We offer a robust benefits program that enables the important work Biohubbers do everyday. Our benefits include healthcare coverage, life and disability insurance, commuter subsidies, family planning services with fertility care, childcare stipend, 401(k) match, flexible time off and a generous parental leave policy. In addition, we honor our commitment to career development and our value of scholarly excellence through regular onsite opportunities to learn from the world's leading scientists.

CZ Biohub is an equal opportunity employer committed to diversity of thought, ideas and perspectives. We are committed to cultivating an inclusive organization where all Biohubbers feel inspired and know their work makes an important contribution. Therefore, we provide employment opportunities without regard to age, race, color, ancestry, national origin, religion, disability, sex, gender identity or expression, sexual orientation, or any other protected status in accordance with applicable law.

Pursuant to the San Francisco Fair Chance Ordinance, we will consider for employment qualified applicants with arrest and conviction records.

Headhunters and recruitment agencies may not submit resumes/CVs through this Web site or directly to managers. CZ Biohub does not accept unsolicited headhunter and agency resumes. CZ Biohub will not pay fees to any third-party agency or company that does not have a signed agreement with CZ Biohub.",3.6,"Chan Zuckerberg Biohub
3.6","San Francisco, CA",-1,1 to 50 Employees,-1,Nonprofit Organization,Health Fundraising Organizations,Non-Profit,Less than $1 million (USD),-1
