Job Title,Salary Estimate,Job Description,Rating,Company Name,Location,Headquarters,Size,Founded,Type of ownership,Industry,Sector,Revenue,Competitors
Admissions and Records Supervisor,$14-$30 Per Hour(Glassdoor est.),"Admissions and Records Supervisor
Ohlone College

Ideal Candidate Statement
The ideal candidate will be an experienced leader with a clear, focused commitment to high-level customer services, learning and academic excellence to promote student success, and efficiencies within the department. He/she will have at least three years of admission and records in a system which utilizes an ERP (Enterprise Resources Planning) system, and proficient use of Colleague, and NextGen Forms. This individual will have a working knowledge of how to leverage technology to improve service and access for students, and have experience with 320 and National Student Clearing House reporting. The successful candidate will also be skilled at training, documenting and maintaining all processes that support a highly automated enrollment process.

Additionally, the ideal candidate will possess excellent communication skills and be able to develop and maintain positive working relationships with business and academic departments, past, present and future students, local k-12 schools, faculty, management, and administrative staff. The candidate is highly ethical, trustworthy, credible, loyal and is respectful of diverse views and opinions. He/she is flexible and inter-culturally competent and is a person whose leadership style is collegial, approachable, and accessible on campus and in the community.

The ideal candidate is able to demonstrate a sensitivity to and understanding of the diverse academic, socioeconomic, cultural, disability, gender identity, sexual orientation, and ethnic backgrounds present in our community.

Job Description Summary
Under general direction of the Dean of Enrollment Services, plans, directs, manages, supervises, oversees, and coordinates the Admissions and Records functions. The Supervisor insures the integrity of all policies, procedures, and programs and works to support the department as a whole. The supervisor coordinates assigned activities with other district departments, divisions, and outside agencies and provides highly responsible and complex administrative support to the Dean of Enrollment Services. The supervisor of Admissions works collaboratively with the supervisor of Financial Aid. The employee must possess a commitment to diversity and inclusion and be comfortable with working with diverse backgrounds i.e. race, gender, socioeconomic, ability, LGBTQIA, etc. This position requires some nights and weekends.

Essential Duties
The following duties are typical of those performed by employees in this job title;
Provides direct supervision to student services programs in Admissions, Records;
Lead the department's commitment to high-touch customer service to create a welcoming environment; provide support to staff when dealing with difficult problems; maintain the department website information to address frequently asked questions
Organizes and supervises the processing of all student record information; coordinate reporting procedures and state requirements;
Review and oversee the processing of all student petitions; oversee grade changes and special situations
Coordinate registration priority; work with other departments to process the loss of BOG and registration priority appeals; oversee the distribution of registration priority to the student body
Coordinates services to students and college personnel and motivates staff to provide high levels of customer service;
Provides leadership, assistance, and monitors the efficiency and effectiveness of service delivery methods and procedures; identify opportunities for improvement
Assist with the planning, organizing registration and awarding cycles in conjunction with Instruction, Student Services, and Information Technology; implements new technologies to improve and automate enrollment functions; Collaborates with College personnel responsible for marketing, outreach and recruitment;
Assists with Selection, development, motivation, and evaluation of assigned personnel; provides or coordinates staff training; work with employees to correct deficiencies; initiate and implement discipline and termination procedures;
Assist the dean in the development of departmental budgets for assigned programs; assist the dean with preparing annual program plans, and oversees mechanisms for budget controls;
Participates in the development and implementation of college goals, objectives, policies, and priorities for assigned programs;
Serves as a member of various College and District committees and task forces; maintains liaison with other college, District, public, and private agencies to assure coordination of activities;
Serves as a liaison with other college departments, divisions, and outside agencies; have an understanding and an ability to resolve significant and controversial issues as appropriate;
Organize and supervise the processing of all student record information; coordinate reporting procedures and state requirements; provide verifications for veteran's benefits, military credit, social security, and other areas;
Assists in the collection, compilation, and reporting on scheduling data for budgeting, enrollment management, apportionment, program review, and planning;
Assists the dean with preparation of various state reports related to apportionment (320), state management information system ( MIS) requirements, and national clearinghouse ( Financial Aid);
Performs other related work as required.

OTHER DUTIES:
Perform related duties as assigned.

Knowledge, Skills, and Abilities
Knowledge of:
Operational and technical knowledge of services, as well as state and federal regulations supporting a comprehensive Admissions and Records;
Technical knowledge of the 320, MIS, and national Student Clearing House Reports Excellent technological proficiency (knowledge of Colleague required)
Principles of customer service and public relations;
Policies regarding student admissions, student records, and transcript requirements; Pertinent federal, state, and local laws, codes, and regulations including the California Education Code requirements and federal requirements for student residence, grading, testing, admissions, records, curriculum, program awards, and general education; thorough understanding of the Family Educational Rights and Privacy Act (FERPA);
Organizational and management practices as applied to the analysis and evaluation of programs, policies, and operational needs; modern and complex principles and practices of enrollment management, program development, and administration;
Principles and procedures of record keeping and statistical reporting;
Outstanding English composition and language usage; formatting and proofreading techniques; Procedures of computerized records systems, systems analysis, and computer applications including integrated databases;
Principles of supervision, training, and performance evaluation; advanced principles and practices of budget preparation and administration;
Modern office procedures, methods, and computer equipment.

Skills and Abilities to:
Manage, direct, and coordinate the work of supervisory, technical, and clerical personnel; Compile, organize, analyze, forecast, and report on large, complex data sets
Select, supervise, train, and evaluate staff;
Provide administrative and professional leadership and support for enrollment management including database searches and dataflow management;
Recommend and implement goals, objectives, and practices for providing effective and efficient services;
Prepare clear and concise administrative and financial reports; perform complex and detailed tasks with accuracy; prepare and administer large and complex budgets;
maintain accurate schedules and records; analyze problems, identify alternative solutions, project consequences of proposed action, and implement recommendations in support of goals; research, analyze, and evaluate new service delivery methods, procedures, and techniques;
interpret and apply federal, state, local, and district policies, procedures, laws, and regulations; be sensitive to, and have an understanding of, the diverse academic, socioeconomic, cultural, and ethnic backgrounds of community college personnel and students;
Communicate clearly and concisely, both orally and in writing;
Establish, maintain, and foster positive and harmonious working relationships with those contacted in the course of work;
Operate modern office equipment including, but not limited to, integrated database systems and general office computer applications.

Education and Experience
ILLUSTRATIVE WORK EXPERIENCE: A typical way to obtain the above knowledge and skill is a combination experience equivalent to:
Five years of increasingly responsible experience in Admissions and Records in an institution of higher education, including one year of administrative and supervisory responsibility. Familiarity with standard student record-keeping procedures, including AACRAO criteria, provisions of FERPA, and other legal issues relating to official academic records or academic history. Working knowledge of the development of curriculum, academic course schedules and catalog, transfer practices, general education, and articulation. Technical knowledge regarding shared databases and student information systems, and reporting including; 320, MIS, and National Student Clearing House.

All candidates must have evidence of responsiveness to and an understanding of the diverse academic, socioeconomic, cultural, disability, gender identity, sexual orientation, and ethnic backgrounds of community college students, as these factors relate to the need for equity-minded practice in all college policies, practices, and personnel.

Physical Characteristics
The physical abilities involved in the performance of essential duties are:
Environment: Office environment, subject to interruptions; off-campus travel required. May require evenings and weekend work.
Physical Abilities: Dexterity of hands and fingers to operate a computer terminal; hearing and speaking to exchange information and make professional presentations; sitting for extended periods of time.

Salary Range
224 ($99,534 - $127,036)

Closing Date
12/15/2020

Foreign Transcripts
Benefits Statement

Immigration Reform & Control Act of 1986
Applicants selected for positions will be required to provide identification and employment eligibility as outlined in the federal ""Immigration Reform & Control Act of 1986.""

District Statement
A multi-campus single community college district, Ohlone College is located in the southern portion of the San Francisco Bay in California; serving 12,000 students per year. The District has a main campus in the City of Fremont and a newly constructed campus in the City of Newark. Ohlone College is an ethnically diverse institution that promotes innovation and continuous improvement in departments and divisions. The College is named for the native population living in the area when Mission San Jose was founded. The Fremont campus is located just south of the historical Mission. The Newark Campus is located near Interstate 880 and emphasizes programs in health, environment, and technology.

EEO Statement
The District is strongly committed to the principles of equal opportunity and to hiring qualified staff who reflect the diversity of our community. The District encourages a diverse pool of applicants and does not discriminate on the basis of sex, race, religious creed, color, national origin, ancestry, age (40 or over), medical condition, genetic information, marital status, sexual orientation, gender, gender identity, gender expression, disability, military and veteran status, pregnancy/childbirth/breastfeeding or related medical condition or any other protected basis in any of its policies, practices, or procedures. The college encourages applications from all qualified applicants.

If you have a disability and are in need of special services, equipment, or facilities in order to apply or interview for this opening, please call the Human Resources office at: (510) 659-6088.

Conditions of Employment
Offers of employment are contingent upon Governing Board approval. Employment with Ohlone Community College is not complete or official until applicants meet all pre-employment requirements. All new employees are required to submit official transcripts and proof of freedom from tuberculosis. In addition you will be required to provide identification and employment eligibility as outlined in the federal ""Immigration Reform & Control Act of 1986."" Pre-employment tests and/or medical examinations may be required. Ohlone Community College does not sponsor H1B visas. Employees must sign the Oath or Affirmation of Allegiance and submit fingerprints for CA Department of Justice clearance.

To apply for the position, please visit: https://employment.ohlone.edu/postings/48167

Copyright 2017 Jobelephant.com Inc. All rights reserved.

Posted by the FREE value-added recruitment advertising agency

jeid-fbf1ff88688d404e9e8872edf2aba833",4.3,"Ohlone College
4.3","Fremont, CA",-1,501 to 1000 Employees,-1,College / University,Colleges & Universities,Education,Less than $1 million (USD),-1
Maintenance II - Ritz Hotel,$12-$19 Per Hour(Glassdoor est.),"Maintenance II - Ritz Hotel
ORGANIZATION OVERVIEW
Mission: TNDC develops community and provides affordable housing and services for people with low incomes in the Tenderloin and throughout San Francisco, to promote equitable access to opportunity and resources.
Established in 1981, TNDC has grown to employ more than 440 staff, to develop, own, manage and provide supportive services in 43 properties that offer deeply affordable housing for nearly 5,000 tenants, and to expand its work in community organizing and afterschool programming. TNDC is viewed as a trusted and well-organized community ally locally and a practice leader nationally. In San Francisco, TNDC envisions diverse communities where people with low incomes can fulfill their potential and meet their basic needs. In the Tenderloin, TNDC stands as a catalyst for advancing community interests and a force for expanding the choices that enhance livability, such as housing, employment, education, food, cultural activities, and open spaces.
TNDC values are: Excellence, Inclusion, Equity, Collaboration and Integrity.
SUMMARY
The Maintenance II is responsible for preventative maintenance work at both TNDC tenant residences and commercial spaces. The Maintenance II provides maintenance and custodial support as needed.
ESSENTIAL DUTIES
General apartment building maintenance and repair.
Basic plumbing repairs to water and sewage systems including replacement of fittings and clearing of stoppages.
Repairs/replaces glass, tile, locks, hinges, and window coverings.
Basic electrical repairs to appliances, fixtures, switches, and circuits.
Basic painting of both interior and exterior surfaces.
Hangs and repairs sheetrock.
Framing, cabinet rebuilding, and finish carpentry.
Rough construction and concrete work.
Prepares and submits completed work order sheets on a daily basis to direct supervisor.
Attends required TNDC team, training, safety, and staff meetings.
Follows TNDC safety policies and procedures at all times.
Responds to building emergencies on after hours on-call schedule.
Other duties as assigned.


REQUIRED SKILLS
Knowledge and Skills:
Ability, willingness and sensitivity to work with a diverse, low-income population.
Maturity, honesty, dependability, initiative and follow-through.
Ability to read and communicate in English sufficiently to follow directions and communicate with supervisor, coworkers and residents.
Ability and willingness to work tactfully under pressure; cope with stress. Problem-solving ability.
Ability to work independently with minimal or no supervision.
Physical Requirements:
Ability to perform medium to heavy work involving sitting, standing, walking, lifting up to 75 pounds and climbing ladders and stairs.
Ability to use a variety of hand and power tools necessary to perform mechanical, carpentry, electrical, plumbing and other building repairs and maintenance work.
Ability to operate a variety of equipment including mechanic tools, carpenter tools, electrical tools, plumbing tools, shovels, rakes, etc.
Ability to move objects, occasionally requiring exertion of considerable force.
Ability to differentiate shades of color in performing electrical maintenance, painting and other work.
Ability to coordinate eyes, hands and fingers in performing maintenance tasks.
Ability to drive motor vehicles, including trucks.
Visual acuity necessary to inspect buildings and review work orders. Hearing acuity sufficient to use telephone and communicate with residents and staff.
Mathematical Ability:
Ability to add, subtract, multiply, divide.
Judgment and Reasoning Ability:
Ability to judge situations where supervisor's involvement is needed.
Ability to apply common sense understanding to semi-repetitive tasks.
Language and Communication Ability:
Ability to comprehend and correctly use maintenance logs, work orders, time sheets, etc.
Ability to comprehend resident handbook and employee manuals.
Ability to communicate effectively with coworkers and staff at all levels, residents, both verbally and in writing.
Ability to adapt to changes in policy, methods, operations, etc. as they apply to property management operations and activities.
Environmental Adaptability:
Ability to work in an office environment and in and outside a variety of residential buildings.
Ability to work under hot and cold conditions.
Ability to work under conditions of moderate noise.
MINIMUM QUALIFICATIONS
1 year of residential maintenance or related building experience.
Ability to lift 75 pounds and climb ladders.
Intermediate plumbing, electrical and drywall skills.
Ability to obtain High-rise Fire Safety Certificate within 6 months.
PREFERRED QUALIFICATIONS
HVAC Certifications.
Knowledge of Cal/OSHA safety requirements and Building Codes.
Lead & Asbestos abatement Certifications/Training.
Valid California drivers’ license and a motor vehicle report that matches TNDC’s insurer’s minimum guidelines.
Tenderloin Neighborhood Development Corporation is an Equal Opportunity Employer.
In compliance with the San Francisco Fair Chance Ordinance (August 13, 2014), all qualified applicants with criminal histories will be considered for the position.",3.8,"Tenderloin Neighborhood Development Corporation
3.8","San Francisco, CA",-1,201 to 500 Employees,1981,Nonprofit Organization,Social Assistance,Non-Profit,$50 to $100 million (USD),-1
Mental Health Therapist | LMFT / LMSW / LPCC,-1,"Therapist | LMFT / LCSW / LPCC - Mental Health Therapist in San Francisco, CA
We are seeking a full-time Therapist | LMFT / LCSW / LPCC - Mental Health practice. We are seeking a Therapist | MFT / MSW / LPCC experience to join the team to work directly with our team of professionals to treat patients. Minimum 32 clinical hours per week during office hours (M-F, 9-6), Average 28-32 clinical hours. *All providers are working remotely during COVID-19*
Therapist | LMFT / LCSW / LPCC - Mental Health Therapist - Responsibilities:
Create comprehensive patient assessments
Aid in treatment planning
Complete documentation in compliance with clinical and state requirements
Aid in building a physician referral network to attract new patients
Work directly with bioengineers and software engineers to create technology to improve therapy patient outcomes
Requirements
1:1 psychotherapy
Weekly consultation meetings with other therapists
Monthly collaboration meetings with psychiatry providers
Create comprehensive patient assessments
Aid in treatment planning
Complete documentation in compliance with clinical and state requirements
Work directly with bioengineers and software engineers to create technology to improve therapy patient outcomes
Masters or doctoral degree from an accredited university or professional school of Counseling, Social Work or Marriage and Family Therapy
Must have CA state licensure- not accepting accept associates or interns
Benefits
$55/hour
Health Insurance, Vision and Dental covered at 80%
PTO/paid sick
401k
Malpractice insurance
In-office perks
#MASC104
#ZR

1:1 psychotherapy Weekly consultation meetings with other therapists Monthly collaboration meetings with psychiatry providers Create comprehensive patient assessments Aid in treatment planning Complete documentation in compliance with clinical and state requirements Work directly with bioengineers and software engineers to create technology to improve therapy patient outcomes Masters or doctoral degree from an accredited university or professional school of Counseling, Social Work or Marriage and Family Therapy Must have CA state licensure- not accepting accept associates or interns",-1,MASC Medical,"San Francisco, CA",-1,1 to 50 Employees,-1,Company - Private,-1,-1,Less than $1 million (USD),-1
ESI Specialist,-1,"Sideman & Bancroft LLP, a premier 39-attorney firm located in the Embarcadero Center, has an immediate opening for an ESI Specialist. This new position will be responsible for overseeing all aspects of e-discovery processes and workflow, and requires a proactive and detail-oriented person with a solid background in all phases of the EDRM.
Responsibilities include electronic files processing, image and data file conversion, forensic analysis, execution of document productions and support of trial presentations. The ESI Specialist will manage and implement processes related to data ingestion, unitization, metadata extraction and field normalization, oversee quality control and organize documentation of critical data and information. Familiarity with industry web based document databases such as Relativity, OpenText/Recommind, and IPRO Enterprise, as well as experience in LAN based databases such as IPRO Eclipse SE, Concordance, CaseMap, and TextMap is essential.
The successful candidate must be able to multitask in a challenging environment and with limited supervision. BA in Computer Science, Engineering, Information Technology, or Management of Information Systems or related areas is preferred, or 4+ years of experience working in E-Discovery services.
Competitive salary and excellent benefits.
Please note that due to COVID-19 health precautions, this position will be remote until Spring 2021 (tentative).
About Sideman & Bancroft LLP
Outstanding culture among partners, associates, and staff.
Strong commitment to diversity.
Dynamic and collaborative working environment.
Sophisticated and quality clients.
A great place for the entrepreneurial where new ideas are always encouraged.
When applying, please send the following:
Resume
Cover Letter
Job Type: Full-time
Schedule:
Monday to Friday
Education:
Bachelor's (Required)
Experience:
eDiscovery: 4 years (Preferred)
Work Location:
One location
Company's website:
https://www.sideman.com/
Work Remotely:
Temporarily due to COVID-19
COVID-19 Precaution(s):
Remote interview process
Virtual meetings",-1,Sideman & Bancroft LLP,"San Francisco, CA",-1,-1,-1,-1,-1,-1,-1,-1
Finish Carpenter / Cabinet Installer,-1,"Training Pay: Carpenter Apprentice: $16.hr - $20 hr
Training Pay: Lead Installer (With Apprentice) : $23.hr - $27.hr
Training Pay: Lead Installer (No Apprentice) : $27.hr - $35.hr
First 90 Days: Skill Evaluation for Wage Increase
First 6 Months: Skill Evaluation for Wage Increase
1 Year: Skill Evaluation for Wage Increase
Do you already have the experience to do the job? Reborn Cabinets is looking for experienced installers for our Kitchen Remodeling Division and want to be a part of our NATIONAL ROLE OUT plan starting this January!
This experienced only position will spend up to 2 weeks training in Reborn University before being assigned an installation team.
To be successful in this position you must already have common experience in all the tools required to perform the job and demonstrate an eye for detail.
Key Responsibilities:
Ability to follow detailed instructions.
Install New Cabinets, Finish Carpentry and Cabinet Refacing in clients homes.
Be willing to learn the Reborn Process!
Requirements:
Minimum 2 years prior experience.
High standard of integrity and professionalism
Attention to detail
Must be customer service driven
Must be able to pass background screening
Must be in good physical condition with no limits on bending, stooping, walking, standing and ability to lift up to 100lbs if necessary.
Schedule:
· M-F & some Saturdays (Overtime built into our schedule)
We offer:
Be a part of our National Role out Plan!!!
Stable work – work up to 52 weeks a year!
Professional paid training program that works!
Excellent Growth Potential
Paid Vacations and Holidays
Generous Benefit Plans:: medical, dental, vision, life, disability and accident insurance and a 401K program are all available to you after 90 days.
Continued Training and Coaching – at Reborn, you’re not just a number, your part of our winning team! You will be treated with respect and recognized for the hard work you do each and every day!
Job Type: Full-time
Pay: $23.00 - $35.00 per hour DOE
Job Type: Full-time
Pay: $23.00 - $35.00 per hour
Experience:
Carpentry: 2 years (Preferred)",4.0,"Reborn Cabinets Inc.
4.0","Oakland, CA",-1,201 to 500 Employees,1983,Company - Private,Construction,"Construction, Repair & Maintenance",$100 to $500 million (USD),-1
