Job Title,Salary Estimate,Job Description,Rating,Company Name,Location,Headquarters,Size,Founded,Type of ownership,Industry,Sector,Revenue,Competitors
Data Scientist,$122K-$196K (Glassdoor est.),"Engineering at Postmates

We're building groundbreaking tech solutions that power our revolutionary logistics platform to help connect millions of customers with their favorite merchants every day. We're tackling some of the most complex technical challenges in the modern logistics space to unlock opportunities that positively impact the local businesses and communities we serve.

WHAT WE DO


Postmates relies heavily on our engineering team to realize this vision. Building a software platform that is reliable, scales, and stays agile under demanding product needs is a serious technical challenge. Postmates is a three-part balancing act connecting customers, merchants, and couriers in real-time. If any piece is out of whack, the whole system suffers. Working with the Postmates engineering team offers an opportunity with explosive growth, cutting-edge technology, a highly visible charter, and a cool user-focused product vision.

As a Data Scientist, you'll use your full toolkit - statistical modeling, machine learning, data mining, data visualization, and software engineering - to develop data products and models that are used by millions of users and power the growth of our business. You will collaborate with a strong team of engineers, product managers and data analysts in defining the frontier of data products and models in the three-sided marketplace. Data scientists will work on how to formulate a model from a real business problem, determine evaluation metrics, evaluate different modeling approaches, conduct data analysis, and build features and algorithms for the various challenging problems at Postmates.

YOUR RESPONSIBILITIES
Modeling and forecasting demand and supply to enable more intelligent matching, optimize the overall marketplace efficiency and provide valuable insights to our merchants and Postmates
Large scale Machine Learning algorithms that powers our Search Ranking models and Personalized Recommendation Engine
Predicting the Postmates Delivery Time (PDT) and improving the dispatching algorithm
Determining the optimal pricing strategies to help our Postmates maximize their revenue
Identifying suspicious transactions and malicious users for risk control
Natural Language Processing to understand text content on Postmates platform, including named entity resolution and recognization of reviews, descriptions and interactions between users on our marketplace
OUR REQUIREMENTS
A Bachelor's/Master's degree (or higher) in a technical field (Computer Science, Statistics, Economics, Operations Research, Math, Physics, Engineering, etc.) or equivalent work experience required.
minimum of 3+ years of professional experience in Data Science or Applied Machine Learning required
A deep theoretical understanding of modern machine learning algorithms, statistical models, or optimization
Extensive experience with data tools, Python (Pandas, Scipy, Numpy, Scikit-Learn, etc), R, SAS, SQL, etc and strong skills in data analysis, data visualization, and feature engineering
Ability to own your modeling work from model development all the way to production deployment and beyond with minimal help from engineers
Strong communication skills; Explaining complex technical concepts to product managers, data analysts, and other engineers shouldn't be a problem for you
OUR PREFERRED QUALIFICATIONS
Experience with MapReduce, Spark, Hive, HBase, Google BigQuery, and BigTable
Experience with ML frameworks like Tensorflow, PyTorch, Spark MLlib, XGBoost, and Scikit-Learn
A bit about us

Postmates is changing delivery for good. While you may know us as the clever brand loved by celebrities and millennials, we are so much more. We are industry-first leaders in the modern logistics space, creating groundbreaking tech products that positively impact millions of customers, merchants and gig-economy workers as well as the underserved in the communities where we work. How will you help us change delivery for good?

Benefits

Postmates has your back. In our impact-first work environment, we value huge company vision. As you strive to build the future with us, we'll support you with a competitive rates and equity plan, along with access to our 401k plan and robust benefits including: health benefits, flexible paid time off, parental benefits, and food perks.

Postmates is proud to be an equal employment opportunity and affirmative action employer. Qualified applicants at Postmates are considered without regards to race, color, religion, national origin, age, sex, marital status, ancestry, physical or mental disability, veteran status, gender identity, or sexual orientation.",3.4,"Postmates
3.4","San Francisco, CA",-1,1001 to 5000 Employees,2011,Company - Private,Express Delivery Services,Transportation & Logistics,Unknown / Non-Applicable,-1
"Data Scientist, Product Analytics",$122K-$196K (Glassdoor est.),"About Gusto

Gusto is a modern, online people platform that helps small businesses take care of their teams. On top of full-service payroll, Gusto offers health insurance, 401(k)s, expert HR, and team management tools. Today, Gusto offices in Denver, San Francisco, and New York serve more than 100,000 businesses nationwide.

Gusto is looking for an ambitious mid- or early-career product analyst with a solid grounding in statistics and data science and at least a few years experience applying this knowledge in a business environment. In this role you will work closely with other members of our Data Science team, as well as our Engineering, Product and Design teams to define and track product metrics, design customer-facing experiments and dive deep into our Payroll, Benefits and HR data to deliver insights.

Gusto's Data Science team leverages Gusto's data to deliver data-informed insights for our customers and guide product direction and decision-making. We operate full-stack, working closely with product managers to apply data insights to strategy and product decisions, conducting analyses, prototyping and deploying predictive models and statistical tools both for internal use and for our customers.

Here's what you'll do day-to-day:
Work closely with product groups to define, measure and report on core product and feature metrics, and to define standards and practices for how product groups work with data
Perform in-depth analyses of our Payroll, Benefits and HR product data to inform and guide product direction and strategy
Design and analyze customer-facing experiments
Work with our business intelligence teams to turn your insights and analyses into clean and consistent reporting
Be a strong voice for a data-informed point of view within our engineering, product and design organization
Collaborate with UX research to design surveys and provide quantitative insights on customer experience
Here's what we're looking for:
At least 2 years experience in a similar role, ideally at a product-focused software company
Strong SQL skills, and comfortable in at least one scripting or statistical programming language (ideally Python and/or R)
Strong knowledge of statistics and experiment design and ability to apply these to conducting and interpreting analyses, data visualization, presentation and recommendations
Excellent communicator - able to effectively deliver findings and recommendations to non-technical stakeholders in a clear and compelling fashion
Passionate about teaching and evangelizing a data-informed approach to product development to product managers, designers and engineers
MS or PhD in a quantitative field + at least 1-2 years experience in a business environment, or BS or Data Science Bootcamp graduate + equivalent experience in a business setting considered
Our customers come from all walks of life and so do we. We hire great people from a wide variety of backgrounds, not just because it's the right thing to do, but because it makes our company stronger. If you share our values and our enthusiasm for small businesses, you will find a home at Gusto.

Gusto's mission is to create a world where work empowers a better life. By making complicated, impersonal business tasks simple and personal, Gusto is reimagining HR, payroll, and benefits for over 100,000 companies nationwide. Gusto has offices in San Francisco, Denver, and New York, and the company's investors include Google Capital, General Catalyst, Kleiner Perkins Caufield & Byers, as well as the founders of Instagram, Stripe, Nest, PayPal, Yelp, Dropbox, and Eventbrite, among others.

Gusto is proud to be an equal opportunity employer. We do not discriminate in hiring or any employment decision based on race, color, religion, national origin, age, sex (including pregnancy, childbirth, or related medical conditions), marital status, ancestry, physical or mental disability, genetic information, veteran status, gender identity or expression, sexual orientation, or other applicable legally protected characteristic. Gusto considers qualified applicants with criminal histories, consistent with applicable federal, state and local law. Gusto is also committed to providing reasonable accommodations for qualified individuals with disabilities and disabled veterans in our job application procedures. If you need assistance or an accommodation due to a disability, you may contact us at accommodations@gusto.com.",3.6,"Gusto
3.6","San Francisco, CA",-1,1001 to 5000 Employees,2011,Company - Private,Computer Hardware & Software,Information Technology,Unknown / Non-Applicable,-1
Data Scientist - TikTok Ads,$122K-$196K (Glassdoor est.),"Data Scientist - TikTok Ads
Mountain ViewProduct - Data analysisExperienced
Responsibilities
TikTok is the leading destination for short-form mobile video. Our mission is to inspire creativity and bring joy. TikTok has global offices including Los Angeles, New York, London, Paris, Berlin, Dubai, Mumbai, Singapore, Jakarta, Seoul, and Tokyo.

The mission of TikTok Ads Platform is to connect global advertisers and users, advertisers of any industry and experience level are able to get suitable marketing solutions, then easily create, manage and optimize ads. The vision is to build an easy-to-understand, easy-to-use and powerful Ads Platform.

Responsibilities:
Work with large, complex data sets. Solve difficult, non-routine analysis problems, applying advanced analytical methods as needed. Conduct analysis that includes data gathering and requirements specification, processing, analysis, ongoing deliverables, and presentations.
Build and prototype analysis pipelines iteratively to provide insights at scale.
Develop comprehensive knowledge of TikTok data structures and metrics, advocating for changes where needed for product development.
Interact cross-functionally, making business recommendations (e.g., cost-benefit, forecasting, experiment analysis) with effective presentations of findings at multiple levels of stakeholders through visual displays of quantitative information.
Research and develop analysis, forecasting, and optimization methods to improve the quality of TikTok ads products.
Qualifications
1. Master's degree in a quantitative discipline (e.g., Statistics, Operations Research, 2. Economics, Computer Science, Mathematics, Physics) or equivalent practical experience.
3+ years of relevant work experience, including expertise with statistical data analysis such as linear models, multivariate analysis, stochastic models, sampling methods.
Experience with statistical software (e.g. R, Python, MATLAB) and database languages (e.g. SQL)
Demonstrated leadership and self-direction. Willingness to both teach others and learn new techniques.
Demonstrated skills in selecting the right statistical tools given a data analysis problem. Effective written and verbal communication skills.
TikTok is committed to creating an inclusive space where employees are valued for their skills, experiences, and unique perspectives. Our platform connects people from across the globe and so does our workplace. At TikTok, our mission is to inspire creativity and bring joy. To achieve that goal, we are committed to celebrating our diverse voices and to creating an environment that reflects the many communities we reach. We believe individuals shouldn't be disadvantaged because of their background or identity, but instead should be considered based on their strengths and experience. We are passionate about this and hope you are too.
Apply
Share to",4.1,"TikTok
4.1","Mountain View, CA",-1,1001 to 5000 Employees,2016,Company - Private,Internet,Information Technology,Unknown / Non-Applicable,-1
Data Scientist,$122K-$196K (Glassdoor est.),"About Gap Inc.


Our brands bridge the gaps we see in the world. Old Navy democratizes style to ensure everyone has access to quality fashion at every price point. Athleta unleashes the potential of every woman, regardless of body size, age or ethnicity. Banana Republic believes in sustainable luxury for all. And Gap inspires the world to bring individuality to modern, responsibly made essentials.

This simple idea—that we all deserve to belong, and on our own terms—is core to who we are as a company and how we make decisions. Our teamis made up of thousands of people across the globe who take risks, think big, and do good for our customers, communities, and the planet. Ready to  learn fast, create with audacity and lead boldly? Join our team.

About the role


The Product Analytics Team at Gap Inc. is a research team that applies techniques from operations research and machine learning to drive business benefits for Gap Inc. and its brands.

The team’s focus is creating analytical capabilities to support product operations at Gap Inc. Areas of expertise include demand forecasting, inventory replenishment, inventory and supply chain optimization, pricing, product testing, product attributes, flexible inventory and supply chain initiatives.

What you'll do
Build, validate, and maintain Operations Research (OR) and/or AI( Machine Learning (ML) /Deep learning), models
Work with large quantities of data in scripting languages
Synthesize findings, prepare presentations and assist in presenting findings to all levels of management
Provide framework/methodology for measurement and feedback mechanism for models
Collaborate within the team and outside the team to solve complex problems
Who you are
Masters in Operations Research, Statistics, Math, Computer Science, Industrial Engineering or related field. PhD is a plus.
Proven experience in areas of optimization, statistics, machine learning, and inventory theory
Ability to develop and apply analytic solutions to solve business problems
Skills to collaborate with cross-functional teams and influence product and analytics roadmap
Hands-on experience with data analysis, statistical, optimization and simulation packages (SQL, Python, SAS, Tensorflow, Hive, etc)
Benefits at Gap Inc.
Merchandise discount for our brands: 50% off regular-priced merchandise at Gap, Banana Republic and Old Navy, 30% off at Outlet and 25% off at Athleta for all employees.
One of the most competitive Paid Time Off plans in the industry.*
Employees can take up to five “on the clock” hours each month to volunteer at a charity of their choice.*
Extensive 401(k) plan with company matching for contributions up to four percent of an employee’s base pay.*
Employee stock purchase plan.*
Medical, dental, vision and life insurance.*
See more of the benefits we offer.
*For eligible employees",3.6,"Gap Inc.
3.6","San Francisco, CA",-1,10000+ Employees,1969,Company - Public,"Department, Clothing, & Shoe Stores",Retail,$10+ billion (USD),-1
"Data Scientist, Autonomy Systems",$122K-$196K (Glassdoor est.),"Who We Are


Nuro is a robotics start-up whose mission is to accelerate the benefits of robotics for everyday life. We have an elite team of entrepreneurs and engineers, designers, and scientists. We believe AI and robotics are at the cusp of transforming daily life and we are dedicated to building meaningful products with this technology. Join us and play a critical role in our mission.

About the Role


The Data Science team uses the data from our autonomous vehicles to drive strategic decision-making throughout the company. You will model the processes and related variances to measure the performance of an autonomous vehicle both on-road and in simulation. Additionally, you will build predictive models to foresee on road behavior and models for root cause attribution.

About the Work
Perform deep-dive analysis that informs how we manage and deploy our fleet of autonomous vehicles
Develop metrics to track our operational performance and inform company-wide decisions
Design and building the operational data model that will take Nuro from vehicle testing to operating a service
Own all stages of model development: problem definition, assessment of data quality, mathematical research, productionization, documentation, and ongoing customer support
Build models and design experiments that seek to undercover truth
Evangelize data-driven decision-making through the organization
About You
PhD preferred or MS in statistics, math, or any other quantitative area
2+ years of experience in statistical estimation, performing analyses that inform decision-making
Hands-on experience with standard statistical methods like linear and logistic regression, SVM, confidence intervals, significance testing
Academic/industry experience applying Bayesian methods, MCMC, Gibbs Sampling to real-world problems
Expertise in writing custom SQL and experience with database design
Strong knowledge of a scripting language (R or python) to move and analyze data
Sound statistical inference skills, with the ability to communicate uncertainty appropriately to engineering and business stakeholders
Experience designing metrics and building mechanisms to fuel business insights
Excellent communication skills
At Nuro, we celebrate differences and are committed to a diverse workplace that fosters inclusion and psychological safety for all employees. Nuro is proud to be an equal opportunity employer and expressly prohibits any form of workplace discrimination based on race, color, religion, gender, sexual orientation, gender identity or expression, national origin, age, genetic information, disability, veteran status, or any other legally protected characteristics.",4.3,"Nuro
4.3","Mountain View, CA",-1,201 to 500 Employees,2016,Company - Private,Computer Hardware & Software,Information Technology,Unknown / Non-Applicable,-1
Data Scientist,$122K-$196K (Glassdoor est.),"ABNORMAL SECURITY.

Abnormal Security is defining the next generation of email security defense. Our platform uses machine learning and artificial intelligence to baseline communication content, user identity, and behavioral signals in real-time and at-scale in order to detect the abnormalities of email attacks.

Customers love us because we consistently detect and stop what everyone else in the market can't -- advanced attacks that have never been seen before -- and we do so with beautiful user interfaces and best-in-industry customer support.

Our veteran team has built some of the most enduring machine learning platforms at leading companies including Google, Twitter, Pinterest, Amazon, Microsoft, and Expanse. We are located in San Francisco and New York City.

Our company is growing - we're on the Forbes AI 50, and a Gartner 2020 Cool Vendor, and our customer base includes multiple Fortune 500 companies.

We are tackling complex and unsolved problems. In order to build the best in class detection of cyber attacks, we need to constantly push the boundaries of our detection system and answer questions such as:
What classes of FN and FPs are we missing?
What additional signals do we need in order to capture these FNs and FPs?
How can we best capture and iterate on a never-before-seen attack?
How do we know a model / feature is working as expected?
What dimensions do we need to evaluate in order to tackle a problem like this at scale with an extremely low False Positive Rate?
YOU:

You want to dig into massive amounts of data to understand what kind of attacks are being delivered. As a Data Scientist, you will drive generating a deep organizational understanding of the attack landscape and work across product/engineering to make sure we are building the best cyber security product in the market. You will spend your time:
Think about how to quantify the world that email security operates in including: attack patterns, model behavior, human behavior, impact etc.
Evaluate quality of the detection product and identify areas of improvements
Experiment with ways to identify product gaps and assess potential solutions
Come up with new methods to capture unremediated risk in the email environment
Generate insights to share with internal team and industry partners
Qualification:
2+ years of experience in a Data Science function working with big data
Ability to work in a highly autonomous manner
Comfortable solving undefined problems
MS / PhD in an analytical field such as Math, Physics, Computer Science, or Economics
Fluent in Python and SQL
Good understanding of statistical methods and ML concepts
Nice to have:
Experience in cyber security or fraud detection
Experience working with a ML-based product
WHY ABNORMAL SECURITY?
Be a small fish in a big pond, work with people who value and enjoy learning from each other
Your work actually makes the world a better place
Solve interesting problems
Innovative culture and team - huge opportunities for personal growth
One of the fastest-growing startups in technology
Competitive pay and equity
Generous PTO and benefits
Family friendly environment",4.1,"Abnormal Security
4.1","San Francisco, CA",-1,51 to 200 Employees,2018,Company - Private,Enterprise Software & Network Solutions,Information Technology,Unknown / Non-Applicable,-1
Data Scientist - Pricing,$122K-$196K (Glassdoor est.),"About Opendoor:
Are you intrigued by the thought of disrupting a trillion dollar industry through technology? At Opendoor, we’re on a mission to make it simple to buy and sell homes. The traditional process is broken, with an average home taking over 90 days to sell and costing thousands of dollars. We empower everyone with the freedom to move by making buying and selling a home stress-free and instant. We’ve built an exceptional team, seen strong growth, served over 80,000 customers (with an annual run rate of $5 billion), and raised $1.3 billion in funding. With Covid-19, the world is changing, and real estate is no exception. The coming years present a tremendous opportunity for innovation as we explore new frontiers and scale nationwide.

As a data scientist on the acquisition pricing team, you will build critical models and analyses that determine which homes we acquire, how much we should pay for them, and how these decisions impact Seller satisfaction as well as our portfolio margin and growth targets. You will rapidly iterate on new approaches to solve pricing problems all the way from idea to execution to evolution. Getting these decisions right is essential to our success as we innovate in new areas of real estate.
As a Data Scientist you will:
Build and evolve our acquisition pricing models at each stage from idea to production
Create feedback loops and other processes to monitor and track our performance versus expectations
Partner with Product, Engineering, Finance and Operations to implement data science in production
Identify innovative approaches to learn in areas of low N and multiple potential confounders
Become a domain expert in real estate and market behavior
We are looking for teammates who have:
2+ years of experience
Proficiency writing SQL queries
Proficiency with Python and its data science libraries
Strong business judgment and orientation toward impact
Knowledge of statistics
Bonus Points if:
Knowledge of causal inference and Bayesian statistics
Experience productionizing data science models and data pipelines
You love delighting customers with simple and low-cost products
You are committed to iteratively driving results and becoming better every day
More About Us
Want to learn more about us and how we are revolutionizing the home buying and selling process? Learn more about us on our website, check out our profile on The Muse to learn more about our culture from our team members, or read our blog posts to hear about the work we are doing.

We Offer the Following Benefits and Perks:
- Full medical, dental, and vision with optional 70% coverage for dependents
- Flexible vacation policy
- Commuter Benefit stipend
- Generous parental leave
- Paid time off to volunteer
Please note that these benefits and perks are available only to Full Time team members and do not apply to contract roles.

Opendoor values Openness
Our team celebrates our diverse backgrounds. We believe that being open about who we are and what we do allows us to be better. Individuals seeking employment at Opendoor are considered without regards to race, color, religion, national origin, age, sex, marital status, ancestry, physical or mental disability, veteran status, sexual orientation, gender identity or other protected status under all applicable laws, regulations, and ordinances.",3.7,"Opendoor
3.7","San Francisco, CA",-1,501 to 1000 Employees,2014,Company - Private,Real Estate,Real Estate,$2 to $5 billion (USD),-1
