Job Title,Salary Estimate,Job Description,Rating,Company Name,Location,Headquarters,Size,Founded,Type of ownership,Industry,Sector,Revenue,Competitors
"Data Scientist, Operations Data Science",$112K-$186K (Glassdoor est.),"Minimum qualifications:
Master's degree in Operations Research, Industrial Engineering, Statistics, related field, or equivalent practical experience.
2 years of relevant work experience (e.g., as a data scientist) or equivalent. Analytical engagements outside class work while at school can be included.
Experience with statistical software (e.g., R, Python) and database languages (e.g., SQL)
Preferred qualifications:
PhD in Operations Research, Industrial Engineering, Statistics or related field.
4 years of relevant work experience (e.g., as a data scientist), including experience applying advanced analytics to planning and infrastructure problems.
Experience designing and building statistical forecasting models.
Experience designing and building machine learning models.
Excellent problem-framing, problem-solving and project management skills.
Excellent customer service and team collaboration skills.
About the job


At Google, data drives all of our decision-making. Data Scientists work all across the organization to help shape Google's business and technical strategies by processing, analyzing and interpreting huge data sets. Using analytical rigor and statistical methods, you mine through data to identify opportunities for Google and our clients to operate more efficiently, from enhancing advertising efficacy to network infrastructure optimization to studying user behavior. As an analyst, you do more than just crunch the numbers. You work with Engineers, Product Managers, Sales Associates and Marketing teams to adjust Google's practices according to your findings. Identifying the problem is only half the job; you also figure out the solution.

As a member of the Operations Data Science team, you will apply operations research and statistical methods to solve challenges related to compute, storage, network, and datacenter capacity for both Google’s internal services and Google Cloud Platform. You will work broadly across Google’s Platforms Engineering, Systems Infrastructure, and Site Reliability Engineering teams to optimize our deployment of resources and drive innovation in our software stack, allowing for efficient use of resources.

As a Data Scientist, you will think critically and strategically about Google’s cloud as a technology, a business, and as an operation. You will be comfortable discussing total cost of management with hardware engineers, resource optimization with software engineers, or reviewing fleet plans and deployment policies with operations executives, all based upon the analytical models that you will be developing.

Behind everything our users see online is the architecture built by the Technical Infrastructure team to keep it running. From developing and maintaining our data centers to building the next generation of Google platforms, we make Google's product portfolio possible. We're proud to be our engineers' engineers and love voiding warranties by taking things apart so we can rebuild them. We're always on call to keep our networks up and running, ensuring our users have the best and fastest experience possible.
Responsibilities
Lead projects with hands-on analysis and modeling, drawing from multiple of analytical methods to choose the right tool and right level of complexity appropriate for the business challenges.
Engage broadly with the organization to identify, prioritize, frame, and structure complex and ambiguous challenges, where advanced analytics projects or tools can have the biggest impact.
Identify and communicate the challenges and opportunities that the group should be working on.
Help define the analytical direction and influence the direction of the associated engineering and infrastructure work.
Articulate business questions and use mathematical techniques to arrive at an answer using data. Translate analysis results into business recommendations.

Google is proud to be an equal opportunity workplace and is an affirmative action employer. We are committed to equal employment opportunity regardless of race, color, ancestry, religion, sex, national origin, sexual orientation, age, citizenship, marital status, disability, gender identity or Veteran status. We also consider qualified applicants regardless of criminal histories, consistent with legal requirements. See also Google's EEO Policy and EEO is the Law. If you have a disability or special need that requires accommodation, please let us know by completing this form.",4.5,"Google
4.5","Mountain View, CA",-1,10000+ Employees,1998,Company - Public,Internet,Information Technology,$10+ billion (USD),-1
Data Scientist - Operations,$112K-$186K (Glassdoor est.),"About the Team
In this role you will use Operations Research, Data Science methods and tools to plan and optimize operations at Stitch Fix. You will build algorithmic solutions to solve business problems around demand and capacity planning, personalized allocation, logistics and warehouse operations - all with the goal to support client satisfaction and company growth.

You're excited about this opportunity because you will…
Perform analyses and build frameworks / solutions to deliver insights for operational decisions
Co-lead the design of cross-functional business processes that leverages what humans and algorithms respectively do best
Maintain and improve algorithmic capabilities in areas such as capacity planning, allocation and warehouse operations
Define, build, and deploy algorithmic capabilities that span multiple functions within the business
Identify and estimate trade-offs between business objectives, such as efficiency, cost, and customer satisfaction. Design, implement, and analyze A/B tests
We're excited about you because you have…
2+ years of experience supporting operational roles (demand planning, supply planning, capacity management, operations)
A Ph.D. or Masters degree in Statistics, Biostatistics, Marketing, Econometrics, Mathematics, or other quantitative fields
Experience writing code (Python preferred) in production environments where you have learned industry practices such as unit testing and code reviews.
The ability to quickly and iteratively prototype analyses and algorithms
A deep understanding business processes, and have experience working with people with different backgrounds, priorities, and responsibilities
The ability to explain complex concepts well and move decisions forward in collaboration with your business partners
An inquisitive nature, and you scrutinize functional efforts through the lens of constantly improving the client experience and the business
Why You'll Love Working at Stitch Fix
We are a group of people who are bright, kind and motivated by challenges. You can be your authentic self here, and are empowered to encourage others to do the same!
We are a successful, fast-growing company at the forefront of tech and fashion, redefining retail for the next generation
We are a technologically and data-driven business
We are committed to our clients and connected through our vision of “Transforming the way people find what they love”
We love solving problems, thinking creatively and trying new things
We believe in autonomy & taking initiative
We are challenged, developed and have meaningful impact
We take what we do seriously. We don't take ourselves seriously
We have a smart, experienced leadership team that wants to do it right & is open to new ideas
We offer competitive compensation packages and comprehensive health benefits
You will be proud to say that you work for Stitch Fix and will know that the work you do brings joy to our clients every day
About Stitch Fix

Stitch Fix is redefining retail shopping using a unique blend of art and science to deliver a deeply personalized service to our customers. This novel juxtaposition—at once analytic and artistic, technical and adventurous—attracts an extraordinary collection of talented people who are both thinkers and doers. Our diverse workforce has catalyzed enormous company growth over the past three years in terms of customer satisfaction and service efficacy. We’d love for you to help us carry on the trend.

Please review Stitch Fix's Recruiting Privacy Policy here:
https://www.stitchfix.com/privacy/usrecruitingprivacy",3.5,"Stitch Fix
3.5","San Francisco, CA",-1,5001 to 10000 Employees,2011,Company - Public,Other Retail Stores,Retail,$500 million to $1 billion (USD),-1
"Data Scientist, Marketing",$112K-$186K (Glassdoor est.),"About the Role

The Marketing team at Twitch is looking for an outstanding Data Scientist with demonstrated experience delivering insights from complex data. You will guide growth in areas that are underserved in marketing like campaign attribution, media mix modeling and other similar problems, creating strategies to re-engage and excite existing viewers while also finding new avenues to profitably acquire new viewers. You will combine domain-knowledge with data-science skills to work with these challenges and many more like them and help implement scalable solutions. You will report into the Marketing Science & Analytics team.



Basic Qualifications


You Will
· Enhance Twitch Marketing's knowledge of our marketing channels, creators and viewers through ownership of science and research projects, from data collection to model development, estimation, and validation
· Work on short / long-term programs that aim to grow our existing and new capabilities in reaching more creators and viewers more effectively
· Measure the impact of our various marketing channels, campaigns and how they interact with each other
· Help leadership make important decisions by generating insights that are rapid, scalable and repeatable
· Conceptualize, develop, and maintain dashboards and visualizations that can be go-to reference assets
· Work with specialists in data science, analytics, engineering, and economics disciplines to develop reliable and reproducible analyses and models at scale
· Deliver well-documented datasets, tools, and reports to key technical and business team members

Preferred Qualifications

You Have
· MS or PhD in data, research, or applied science team OR equivalent applied research experience
· 4+ years working in a data-science role
· Expertise in applying supervised and unsupervised algorithms to large-scale data
· Experience with SQL, preprocessing (e.g. unix/Python), and statistical analysis (Python)
· Experience with data pipelining, from data preparation to analysis to deployment
· Experience with Marketing analytics and experimentation
Bonus Points
· Advanced knowledge of machine-learning techniques (supervised and unsupervised)
· Prior work experience at a high-growth tech company
· Working knowledge of Tableau or other visualization software
· Experience in an industry that has a community dynamic (like gaming or social media)
· You are familiar with Twitch and use it frequently",3.9,"Amazon
3.9","San Francisco, CA",-1,10000+ Employees,1994,Company - Public,Internet,Information Technology,$10+ billion (USD),-1
"Product Data Scientist, Discover",$112K-$186K (Glassdoor est.),"Snap Inc. is a camera company. We believe that reinventing the camera represents our greatest opportunity to improve the way people live and communicate. Our products empower people to express themselves, live in the moment, learn about the world, and have fun together.
Snapchat is the camera used by millions of people every day to Snap with family, watch Stories from friends, see events from around the world, and explore expertly curated content from top publishers. In short, we are a passionate team working hard to build the best platform in the world for communication and storytelling.
We are looking for a Data Scientist to join our Product team at Snap Inc! Working from our San Francisco office, you will use data to help the team understand what is working, what to improve and what gaps we have. Partnering with Product, Design and Engineering, you will be a core member in driving our overall roadmap and long-term strategy
What you’ll do:
Use your quantitative skill sets to present data in an organized way that goes beyond the numbers and articulates how Snapchat Users interact with our products
Set product goals, design and evaluate experiments, monitor the health of our products and understand changes to our KPIs
Partner with Product, Design and Engineering to influence and inform our roadmap, strategy and product launches
Exploratory analysis that influence longer-term thinking including understanding how our products impact the broader ecosystem and user behavior trends
Knowledge, Skills, Abilities:
Excellent verbal and written communication skills, with high attention to detail
Strong statistical knowledge
Ability to initiate and drive projects to completion with minimal guidance
A team player who can collaborate with engineers, product managers, designers and other cross-functional teams
Minimum Qualifications:
Bachelor’s degree in math, statistics, computer science, or other quantitative field
3+ years of experience in quantitative analysis & data science or a related field
Fluency in SQL or other big data querying language
Preferred Qualifications:
Master or Ph.D degree in math, statistics, computer science, or other quantitative field
Experience with causal inference techniques, experimental design and/or A/B testing
Experience with analytical packages such as SciPy or R
Experience with a programming language, such as Python
Experience in a product-focused role at a social media and/or mobile technology company
At Snap, we believe that having a team of diverse backgrounds and voices working together will enable us to create innovative products that improve the way people live and communicate. Snap is proud to be an equal opportunity employer, and committed to providing employment opportunities regardless of race, religious creed, color, national origin, ancestry, physical disability, mental disability, medical condition, genetic information, marital status, sex, gender, gender identity, gender expression, pregnancy, childbirth and breastfeeding, age, sexual orientation, military or veteran status, or any other protected classification, in accordance with applicable federal, state, and local laws. If you have a disability or special need that requires accommodation, please don’t be shy and contact us at accommodations-ext@snap.com .",4.0,"Snapchat
4.0","San Francisco, CA",-1,1001 to 5000 Employees,2011,Company - Public,Computer Hardware & Software,Information Technology,Unknown / Non-Applicable,-1
Data Scientist,$112K-$186K (Glassdoor est.),"What you'll need:

Education
Master's/PhD (preferred) or Bachelor's (required) in CS/ML/AI or relevant computational/engineering discipline

Machine Learning/Data Science:
Solid theoretical understanding of ML fundamentals: linear algebra, probability, statistics (as relevant to ML), optimization
Knowledge of different ML techniques and when/how to use them: classification, regression, clustering, outlier detection, dimensionality reduction, etc.
Comfortable manipulating and analyzing complex, high-volume, high-dimensionality data from varying, heterogeneous sources
Experience with messy real-world data -- handling missing/incomplete/inaccurate data
Proficient in the Python ML ecosystem: NumPy, Pandas, SciPy, Scikit-Learn
Strong understanding of relational databases like PostgreSQL is a plus

Programming experience:
At least 2+ years of experience writing production-quality Python code
Version control: Git, GitHub/Bitbucket
Experience delivering large-scale deployable projects

Great to have
We deal with large volumes of geospatial data, so experience working with geospatial data at scale is a big plus
Knowledge of Python (Shapely, GeoPandas, Fiona, CartoPy, etc) and/or database (PostGIS) geometry/geospatial tools
Domain experience in building models for location-based services, transportation, scheduling, vehicle routing",1.8,"Miles
1.8","Redwood City, CA",-1,1 to 50 Employees,2016,Company - Private,Internet,Information Technology,Unknown / Non-Applicable,-1
Data Scientist,$112K-$186K (Glassdoor est.),"About Unlearn

Recent progress in artificial intelligence coupled with a growing resource of longitudinal patient data from historical clinical trials and real world sources provides an unprecedented opportunity to transform clinical trials and speed the development of new medicines.

Unlearn is a science-first company that has invented the first machine learning platform for creating Digital Twins of patients in clinical trials — comprehensive simulations that answer “what would likely happen to this patient if he/she were randomized to the control group?”.

Using information from Digital Twins to estimate treatment effects reduces required sample sizes, increase statistical power, and provides patient-level treatment response information.

It's about increasing confidence in trial results.

It's about bringing new medicines to patients faster.

It's about time.

Your role at Unlearn

Do you enjoy using data science and software to solve complex challenges?

Unlearn.AI pioneers computational methods to help patients get life-saving therapies more quickly. As an early employee at Unlearn, you will have the opportunity to shape the future of how data are used in clinical science and join a world-class team of computational scientists.

Day-to-day work will include:
Using our powerful, proprietary software tools to transform clinical trial data and electronic health data into tidy datasets that enable machine learning models of disease progression.
Researching outcome measures, biomarkers, and other data that are measured in clinical trials.
Creating and editing documentation and processes to ensure quality in Unlearn's datasets and resulting products.
Providing feedback to the data infrastructure engineering team to improve software used for data processing.
Collaborating with internal and external scientists to create prognostic models of disease progression, analyze clinical trials, and publish scientific results.
Your qualifications

You are an entrepreneurial data scientist who wants to build a new, computationally-focused approach to important problems in healthcare.

You'll likely have:
B.S. in Computer Science, Statistics, or a related field. Advanced degree such as an M.S. or Ph.D. is a plus.
3+ years industry experience in data science or a related role.
Experience with the analysis and use of clinical data.
Proficient in Python (including data science tools such as numpy, pandas, and sklearn) and collaborative software development (e.g., git, using clean coding styles).
Strong analytical and organizational skills.
Excellent communication and collaboration skills.
The flexibility and adaptability necessary to be an early employee at an ambitious startup.
Compensation & benefits

Unlearn offers compensation commensurate with experience as well as a competitive benefits package, including:
Generous equity participation.
Unlimited PTO plus company holidays.
Annual company-wide shutdown between Christmas and New Years holidays.
Professional development budget to attend conferences or other events.
401k plan with generous matching.
Company-subsidized medical, dental, & vision insurance plans.
Commuter benefits plan.
Paid Parental Leave.
Unlearn is not currently offering visa sponsorships for any position. Please only apply if authorized to work in the U.S.",5.0,"Unlearn.AI
5.0","San Francisco, CA",-1,1 to 50 Employees,2017,Company - Private,Biotech & Pharmaceuticals,Biotech & Pharmaceuticals,Unknown / Non-Applicable,-1
Data Scientist,$112K-$186K (Glassdoor est.),"Your Mission

As a Data Scientist in Mobileum you will work within the Engineering Risk BU and you will contribute to the evolution of Mobileum Active Intelligence platform with improved analytics capabilities to deliver telecom-industry leading data analytics and machine learning platform. You will work integrated in the ML and Analytics team wrangling data problems from identifying data requirements to implementing analytics and machine learning solutions from experiments into production pipelines.

This position will be based in Braga and/or Lisbon.

WHAT WE ARE LOOKING FOR

To join our team, YOU must HAVE:
A degree in Statistics, Mathematics, Computer Science or similar;
3+ years of experience manipulating data sets and building statistical models;
Experience in developing and deploy production ML pipelines;
Good applied statistics skills, such as distributions, statistical testing, regression, etc;
Experience using statistical computer languages (Python, SQL, etc.) to manipulate data and extract insights from large data sets;
Excellent understanding of machine learning techniques and algorithms and their real-world advantages/drawbacks, such as k-NN, Naive Bayes, SVM, XGBoost, Decision Forests, Autoenconders, LSTMs, AutoML, etc;
knowledge on design and optimizing outlier models is a plus;
Experience with common data science toolkits, such as R, NumPy, Scikit-learn, PyOD etc ;
Experience with data visualisation tools, such as GGplot, Matplotlib, Seaborn, etc
Good scripting and programming skills using languages like Python and Java
Experience on using technologies such like SOAP, REST APIs, XML, Spark, Hive;
Linux knowledge and shell scripting programming;
A drive to learn and master new technologies and techniques
Read, write and talk English every day in a multi-cultural environment.


And YOU must BE:
Be a practical and results oriented person;
Be available to travel;
Enjoy designing and implement new products;
Methodical;
Be product but also customer oriented;
Enjoy challenges;
If you feel that you've got what it takes to work with us and want to join a young and dynamic team, APPLY NOW!!!

Your Mission

As a Data Scientist in Mobileum you will work within the Engineering Risk BU and you will contribute to the evolution of Mobileum Active Intelligence platform with improved analytics capabilities to deliver telecom-industry leading data analytics and machine learning platform. You will work integrated in the ML and Analytics team wrangling data problems from identifying data requirements to implementing analytics and machine learning solutions from experiments into production pipelines.

This position will be based in Braga and/or Lisbon.

WHAT WE ARE LOOKING FOR

To join our team, YOU must HAVE:
A degree in Statistics, Mathematics, Computer Science or similar;
3+ years of experience manipulating data sets and building statistical models;
Experience in developing and deploy production ML pipelines;
Good applied statistics skills, such as distributions, statistical testing, regression, etc;
Experience using statistical computer languages (Python, SQL, etc.) to manipulate data and extract insights from large data sets;
Excellent understanding of machine learning techniques and algorithms and their real-world advantages/drawbacks, such as k-NN, Naive Bayes, SVM, XGBoost, Decision Forests, Autoenconders, LSTMs, AutoML, etc;
knowledge on design and optimizing outlier models is a plus;
Experience with common data science toolkits, such as R, NumPy, Scikit-learn, PyOD etc ;
Experience with data visualisation tools, such as GGplot, Matplotlib, Seaborn, etc
Good scripting and programming skills using languages like Python and Java
Experience on using technologies such like SOAP, REST APIs, XML, Spark, Hive;
Linux knowledge and shell scripting programming;
A drive to learn and master new technologies and techniques
Read, write and talk English every day in a multi-cultural environment.


And YOU must BE:
Be a practical and results oriented person;
Be available to travel;
Enjoy designing and implement new products;
Methodical;
Be product but also customer oriented;
Enjoy challenges;
If you feel that you've got what it takes to work with us and want to join a young and dynamic team, APPLY NOW!!!",3.2,"Mobileum
3.2","Cupertino, CA",-1,501 to 1000 Employees,2000,Company - Private,Computer Hardware & Software,Information Technology,$100 to $500 million (USD),-1
